id,title,description,level,language,url
hEMZ5zJuEeaGtRI0HQleow,"HI-FIVE: Health Informatics For Innovation, Value & Enrichment (Clinical Perspective)","HI-FIVE (Health Informatics For Innovation, Value & Enrichment) Training is a 12-hour online course designed by Columbia University in 2016, with sponsorship from the Office of the National Coordinator for Health Information Technology (ONC).  The training is role-based and uses case scenarios.  Also, it has additional, optional modules on other topics of interest or relevance.  Although we suggest to complete the course within a month's timeframe, the course is self-paced and so you can start and finish the course at anytime during a month's time period. No additional hardware or software are required for this course.

Our nation’s healthcare system is changing at a rapid pace. Transformative health care delivery programs depend heavily on health information technology to improve and coordinate care, maintain patient registries, support patient engagement, develop and sustain data infrastructure necessary for multi-payer value-based payment, and enable analytical capacities to inform decision making and streamline reporting.  The accelerated pace of change from new and expanding technology will continue to be a challenge for preparing a skilled workforce so taking this training will help you to stay current in the dynamic landscape of health care.

This course is one of three related courses in the HI-FIVE training program, which has topics on population health, care coordination and interoperability, value-based care, healthcare data analytics, and patient-centered care.  Each of the three courses is designed from a different perspective based on various healthcare roles.  This first course is from a clinical perspective, geared towards physicians, nurse practitioners, physician assistants, nurses, clinical executives and managers, medical assistants, and other clinical support roles.  However, we encourage anyone working in healthcare, health IT, public health, and population health to participate in any of the three trainings.",BEGINNER,English,https://www.coursera.org/learn/hi-five-clinical
qRzsCVEUEeeF5RIYZYolcA,Asymmetric Cryptography and Key Management,"Welcome to Asymmetric Cryptography and Key Management! 

In asymmetric cryptography or public-key cryptography, the sender and the receiver use a pair of public-private keys, as opposed to the same symmetric key, and therefore their cryptographic operations are asymmetric. This course will first review the principles of asymmetric cryptography and describe how the use of the pair of keys can provide different security properties. Then, we will study the popular asymmetric schemes in the RSA cipher algorithm and the Diffie-Hellman Key Exchange protocol and learn how and why they work to secure communications/access. Lastly, we will discuss the key distribution and management for both symmetric keys and public keys and describe the important concepts in public-key distribution such as public-key authority, digital certificate, and public-key infrastructure. This course also describes some mathematical concepts, e.g., prime factorization and discrete logarithm, which become the bases for the security of asymmetric primitives, and working knowledge of discrete mathematics will be helpful for taking this course; the Symmetric Cryptography course (recommended to be taken before this course) also discusses modulo arithmetic.

This course is cross-listed and is a part of the two specializations, the Applied Cryptography specialization and the Introduction to Applied Cryptography specialization.",INTERMEDIATE,English,https://www.coursera.org/learn/asymmetric-crypto
hzlA6mf1EfCg9wr_w-3how,Advanced Guide to Adobe InDesign CC: Tables & Effects,"This course is all about taking your editorial layouts and workflow even further. Your course instructor, Kate Silver, will dive deep into tables, text data management, object styles, blending modes, and subtle effects to give your designs that polished, professional edge. If you’ve been doing things the long way in InDesign, I’ll show you faster, smarter methods.

By the end of this course, you’ll be able to:
* Build clean, data-driven tables and stylish timetables
* Apply object styles, shadows, and graphic effects with confidence
* Remove image backgrounds using clipping paths
* Use tools like the Story Editor, Gridify, and Find/Change to save hours

You’ll design projects like a table-based coffee book, flyers, and an editorial-style timetable, all while learning 60+ tools and time-saving tricks. 
This class is perfect for designers looking to improve their technical layout skills and produce print or digital pieces for real clients. 

You’ll need a working knowledge of InDesign and some experience using paragraph styles and page layout features to succeed.

Instructor bio:
Kate Silver is a graphic and shoe designer, Top Teacher on Skillshare, and instructor at the UK’s leading Adobe training center in London. She creates beginner and advanced courses on design software including Adobe Photoshop, Illustrator, InDesign, Canva, and more.

With experience designing for brands like Jimmy Choo and Sophia Webster, Kate brings hands-on expertise to her classes, making complex tools simple and accessible. Her lessons focus on clarity, practical projects, and smart shortcuts to help students build real skills with confidence.",INTERMEDIATE,English,https://www.coursera.org/learn/advanced-guide-to-adobe-indesign-cc-tables--effects
w6WbWj15Eey2HhKRvGWgpQ,Central Banks and Monetary Policy,"The purpose of this course is to provide you with an understanding of central bank policies and how such policies affect financial markets and the economy. The main aim of this course is to provide you with insights about the macroeconomic relationships between interest rates, inflation, and unemployment that allow you to assess central bank actions and appreciate how this action will affect the economy. The ability to extract relevant information from financial market and economic data about the macroeconomic environment and central bank actions is an important skill that will be useful for your decision-marking in your professional career and your personal financial choices.",INTERMEDIATE,English,https://www.coursera.org/learn/central-banks-monetary-policies
waqd4rxZEe-LvhIuPUA7nw,Inventory Management,"The courseware is designed to equip participants with a profound understanding of Inventory Management. Tally is a revolutionary product which has been created with the objectives of Simplify the Simplest, Greater Flexibility and New Look and Feel, and our course also describes the same. Inventory Management provides a thorough understanding of key concepts and practices essential for effective control and optimization of inventory within organizational settings. The course is designed to equip participants with the knowledge and skills necessary to implement efficient inventory management strategies, ensuring smooth operations and cost-effectiveness.

The course covers key topics such as -
-The fundamental concepts of storage and classification of inventory for streamlined management.
-The significance of purchase and sales order management processes in inventory control.
-Techniques to track additional costs of purchase and integrate them into inventory systems.
-Insights into the manufacturing process, including its impact on inventory and job work management.
-Proficiency in job costing to accurately assess and allocate costs.
-Understanding and utilizing inventory reports to analyze and enhance business operations.

This course is suitable for individuals aspiring to pursue careers in inventory management, operations, or accounting. It is also ideal for business professionals seeking to enhance their skills in inventory control and optimization using Tally. Additionally, business owners and managers responsible for overseeing inventory processes within their organizations will benefit from this course. Students or graduates looking for practical knowledge in inventory management through Tally software are encouraged to enroll.",INTERMEDIATE,English,https://www.coursera.org/learn/inventory-management-in-tally
8UtEZ8uGEeu0Vgq9qoHWjQ,How to Create an Instagram Business Account,"By the end of this project, learners will have an understanding on how to create an Instagram Business account. According to Facebook, “with a business account, you'll be able to access insights that can help you understand who is engaging with your business on Instagram. You also have access to the Professional Dashboard, where you can track your performance, access and discover professional tools, and explore educational information curated by Instagram.”

Note: This course works best for learners who are based in the North America region. We’re currently working on providing the same experience in other regions.",BEGINNER,English,https://www.coursera.org/learn/how-create-instagram-business-account
8iTq0Tv0EfCvexL6Zx2PNQ,Learn GitHub Flavored Markdown,"This course features Coursera Coach!
A smarter way to learn with interactive, real-time conversations that help you test your knowledge, challenge assumptions, and deepen your understanding as you progress through the course.

Master GitHub Flavored Markdown (GFM) and unlock the ability to create well-structured, readable documents for the web. By the end of this course, you will have hands-on experience with all aspects of Markdown, from formatting text to embedding images, creating links, and organizing content into neat tables. Whether you're documenting your project, writing README files, or contributing to GitHub repositories, this course equips you with the skills to produce clear, concise content.

The course begins by introducing you to the fundamentals, such as how Markdown works and how to write in it. You'll quickly dive into text formatting, exploring options like italicizing, bolding, and creating blockquotes. Then, you'll progress to more advanced features like inserting external and internal links, images, and tables. You'll also learn how to write clean, organized code snippets and create task lists for project tracking.

Along the way, you'll be encouraged to experiment with various features of Markdown, making the learning process hands-on and practical. By the time you complete the course, you'll be comfortable working with all the core elements of Markdown and confident in your ability to use it in any GitHub-based project.

This course is ideal for beginners looking to improve their documentation skills or anyone interested in learning how to use GitHub more effectively. No prior experience with Markdown is required, and the course is accessible to all skill levels.",BEGINNER,English,https://www.coursera.org/learn/packt-learn-github-flavored-markdown-apxgp
LQMVqakqEeyjPxJkzIUqCw,Dataflow: Qwik Start - Templates,This is a self-paced lab that takes place in the Google Cloud console. This page shows you how to create a streaming pipeline using a Google-Provided Cloud Dataflow template.,BEGINNER,English,https://www.coursera.org/learn/googlecloud-dataflow-qwik-start-templates-jvtzv
f6s8aXQ3EeWIfhKr_WcYsQ,Essential Design Principles for Tableau,"In this course, you will analyze and apply essential design principles to your Tableau visualizations. This course assumes you understand the tools within Tableau and have some knowledge of the fundamental concepts of data visualization. You will define and examine the similarities and differences of exploratory and explanatory analysis as well as begin to ask the right questions about what’s needed in a visualization. You will assess how data and design work together, including how to choose the appropriate visual representation for your data, and the difference between effective and ineffective visuals. You will apply effective best practice design principles to your data visualizations and be able to illustrate examples of strategic use of contrast to highlight important elements. You will evaluate pre-attentive attributes and why they are important in visualizations. You will exam the importance of using the ""right"" amount of color and in the right place and be able to apply design principles to de-clutter your data visualization.",BEGINNER,English,https://www.coursera.org/learn/dataviz-design
NDBJAUWDEeWbNhIvIryYow,Investment Management in an Evolving and Volatile World by HEC Paris and AXA Investment Managers,"Have you ever wanted to invest in financial markets, but were always afraid that you didn’t have the proper tools or knowledge to make informed decisions? Have you ever wondered how investment management companies operate and what fund managers do? AXA Investment Managers, in partnership with HEC Paris, will introduce you to the most important ideas and concepts in investment management, to help you better understand your financial future.

This course will enable you to:
•	Define what type of investor you are, your investment objectives, and potential constraints. 
•	Identify the main investable assets and important players in financial markets. 
•	Understand basic portfolio management techniques. 
•	Apply these techniques in real case studies from the outset, through practical assessments. 

Finally, we will provide a comprehensive overview of today's asset management industry: the product cycles, professionals, and regulations. For those who want to identify a talented fund manager to invest for you, we offer important criteria for selecting one. For those who are interested in learning more about this fascinating industry, we lay the foundation for your ongoing financial journey. Join us now to explore the world of investment management! 

Course Specialists
The course has been developed in collaboration between HEC Paris, with Hugues Langlois managing the academic aspect, and AXA Investment Managers specialists, sharing their experiences and expertise and coordinated by Marion Le Morhedec. AXA Investment Managers participants include Maxime Alimi, Stephanie Condra, Nicholas Jeans, Elodie Laugel, Pierre-François de Mont-Serrat, Jean-Gabriel Pierre (AXA Group), Dorothée Sauloup, Irina Topa-Serry, Fiona Southall, Patrice Viot Coster, Susanna Warner, and Joachim Weitgasser.

Recommended Background
We expect most participants to have a basic level of knowledge in mathematics and economics. However this is not essential, and we believe that people from any background can succeed with commitment and a strong interest.
Be aware that in the case study, you will have to use Excel.

Course Format 
This course will run for 4 weeks and consists of 4 modules, each with a series of lecture videos between 5 to 8 minutes long. Each module contains a set of practice and graded quiz questions. A complete portfolio management exercise covers concepts learned in all modules

Language
The course is in English, with Spanish, Italian, German, French, and Chinese (Simplified) subtitles.

The Project
The preparation of this MOOC has been an exciting adventure for many professionals at AXA Investment Managers and HEC, both for the speakers and a wealth of contributors. Thank you to all of them.
We hope you enjoy this course as much as we enjoyed creating it!",INTERMEDIATE,English,https://www.coursera.org/learn/investment-management
9YqxqpCGEfCNOA4OvopBdw,Machine Learning with Python: Build & Optimize,"By the end of this course, learners will be able to build, evaluate, and optimize machine learning models using Python. They will develop the ability to preprocess data with NumPy and Pandas, visualize insights using Matplotlib, and implement workflows with scikit-learn pipelines. Learners will apply regression, classification, clustering, and dimensionality reduction techniques to real-world datasets, while mastering hyperparameter tuning for improved model performance.

This course is designed to bridge theory with practice, offering hands-on experience in every stage of the machine learning lifecycle—from data collection and preparation to model deployment. Unlike traditional courses, it emphasizes practical coding exercises and end-to-end project workflows, ensuring that learners gain both conceptual clarity and applied skills.

Upon completion, learners will be equipped with the essential tools and confidence to tackle data-driven problems, analyze large datasets, and create scalable machine learning solutions. Whether pursuing a career in data science or enhancing analytical skills, this course provides a comprehensive pathway into applied machine learning with Python.",Not Specified,English,https://www.coursera.org/learn/machine-learning-python-build-optimize
Pxw2CpOcEfCnbQr_8XAuZw,ChatGPT Clone using React.js,"This course features Coursera Coach!

A smarter way to learn with interactive, real-time conversations that help you test your knowledge, challenge assumptions, and deepen your understanding as you progress through the course.
In this hands-on course, you will build a powerful AI chatbot application using React.js. Starting with an introduction to the fundamentals of React, you'll explore components, props, and state management—essential skills for any web developer. As you progress, you'll dive into creating the chat interface, integrating the ChatGPT API, and enhancing the user experience with local storage and environment variables. Along the way, you’ll tackle error boundaries, styling, and loading indicators, all while refining your React.js expertise.

The course guides you step-by-step, from building the chat window and input system to deploying the app live on Vercel. Each section is designed to provide you with the skills necessary to create a real-world AI chatbot. You’ll implement the ChatGPT API using Axios, handle asynchronous processes smoothly, and store user data effectively.

This course is ideal for developers looking to expand their front-end skills while exploring AI integration. With its hands-on approach, you'll leave with a fully functional ChatGPT clone that is production-ready.

By the end of the course, you will be able to build dynamic, interactive web applications with React.js, integrate external APIs, and deploy apps to Vercel. Additionally, you'll gain the ability to manage state and props effectively, implement error boundaries, and style React components to create a seamless user experience.",INTERMEDIATE,English,https://www.coursera.org/learn/packt-chatgpt-clone-using-react-js-feurm
pROf0k-oEe2bJApRrwt-kw,Health Equity Research & Practice: Local & Global Lessons,"This course introduces students to the local and global lessons in health equity research and practice, covering topics such as the effects of structural drivers and systems of power on health equity and inequities in reproductive health and immigrant health. This course then goes on to apply these lessons to health equity research projects in settings around the world. Through exploration of global interventions, learners will be prepared to take on health disparities in their local communities by understanding why these health problems exist, what contributes to them, and how to create sustainable solutions. This course includes lectures, panel discussions, and interviews with leading experts.",BEGINNER,English,https://www.coursera.org/learn/local-and-global-best-practices-in-health-equity-research
XpseBGDgEfCy5w726iKh0Q,Linux Foundation Certified System Administrator (LFCS): Unit 2,"This course delves into the critical aspects of Linux permission management, user and group administration, and storage management. Begin by understanding the foundational read, write, and execute permissions, and advance to mastering SUID, SGID, and sticky bits for specialized scenarios. Gain comprehensive skills in managing users and groups, essential for setting permissions and maintaining security. Explore storage management essentials, including partitioning, file systems, and mounting techniques. With practical labs and real-world scenarios, this course ensures you gain hands-on experience and confidence in managing Linux systems.",INTERMEDIATE,English,https://www.coursera.org/learn/pearson-linux-foundation-certified-system-administrator-lfcs-complete-vide-us8uc
7OsltpSqEfCMGg5tbt5J0w,Bitcoin for Everyone,"Bitcoin is no longer niche - it’s a force reshaping finance, business, and global economies. But for most people, it still feels complex and inaccessible. Bitcoin for Everyone is designed to change that. This course breaks down Bitcoin’s history, mechanics, and impact into simple, practical lessons that anyone can grasp - whether you’re a business leader, investor, policymaker, or just curious about the future of money.

You’ll learn how transactions work, how to set up and secure a Bitcoin wallet, and how Bitcoin fits into the broader financial system. We’ll explore its economic significance, the regulatory debates shaping its future, and what its rise means for industries from banking to entrepreneurship.

The Bitcoin market is projected to grow from USD 16.43 billion in 2025 to USD 28.22 billion by 2030 (Mordor Intelligence), creating a growing need for professionals and informed citizens who understand its opportunities and risks.

By the end, you won’t just “know about Bitcoin” - you’ll be confident discussing, using, and applying it in real-world contexts. No technical expertise required, just curiosity and a willingness to learn.",BEGINNER,English,https://www.coursera.org/learn/bitcoin-for-everyone
vt3GiQCJEfCehwr_ziEUiw,HashiCorp Vault Foundations and Secrets Management,"Updated in May 2025.

This course now features Coursera Coach!

A smarter way to learn with interactive, real-time conversations that help you test your knowledge, challenge assumptions, and deepen your understanding as you progress through the course.

In this course, you will gain a deep understanding of HashiCorp Vault and how it helps manage secrets in an automated and secure way. You will learn about Vault’s various secrets engines, authentication methods, and security features. By the end, you’ll be proficient in setting up Vault in real-world scenarios, enabling you to securely manage credentials, encryption keys, and sensitive data for your organization. The course focuses on hands-on demos and practical implementations to ensure you're ready for real-world applications.

You’ll start by familiarizing yourself with Vault’s core concepts, including the Key/Value Secrets Engine, Database Secrets Engine, and Transit Secrets Engine. Then, you'll dive deeper into the security hardening aspects of Vault, such as auto-unsealing, integrated storage, and Vault initialization. Through demos, you’ll configure these engines and methods to understand how they interact with one another.

As you move through the course, you’ll configure different authentication methods like AppRole, Userpass, and Vault tokens, learning how each plays a role in ensuring access to secrets. The course also covers critical aspects like regenerating root tokens, securing Vault initialization, and rotating encryption keys, ensuring your Vault deployment remains secure and resilient.

This course is ideal for security engineers, DevOps professionals, and anyone looking to strengthen their skills in secrets management and Vault security. No prior experience with HashiCorp Vault is required, but familiarity with IT infrastructure, cloud computing, or security concepts will be helpful. The course is structured for learners of all levels but leans toward an intermediate understanding of security and cloud technologies.",INTERMEDIATE,English,https://www.coursera.org/learn/packt-hashicorp-vault-foundations-and-secrets-management-hbxj3
kDy16R-8Eee1gxLK2jyL4g,Web and Mobile Testing with Selenium,"Modern applications that we build invariably have touch-points with its users through web-based and mobile platforms.  Users interact with the software through these interfaces and the experiences those interfaces provide have a strong influence on the perceived quality of the software.  

The pace at which modern applications deploy new versions and features call for careful prioritization of testing effort and rapid execution through automation. Techniques and methods for testing of such applications will be the focus of this course. We will cover key concepts relevant to testing of web and mobile platforms, underlying techniques and the use of Selenium as a framework for automating testing of such applications.

The learner will gain a solid foundation in web and mobile testing principles and the ability to use a testing framework to automate test execution.",INTERMEDIATE,English,https://www.coursera.org/learn/web-mobile-testing
