id,title,description,level,language,url
qqP6hnElEeWi0g6YoSAL-w,"GIS Data Formats, Design and Quality","In this course, the second in the Geographic Information Systems (GIS) Specialization, you will go in-depth with common data types (such as raster and vector data), structures, quality and storage during four week-long modules: 

Week 1: Learn about data models and formats, including a full understanding of vector data and raster concepts. You will also learn about the implications of a data’s scale and how to load layers from web services. 

Week 2: Create a vector data model by using vector attribute tables, writing query strings, defining queries, and adding and calculating fields. You'll also learn how to create new data through the process of digitizing and you'll use the built-in Editor tools in ArcGIS.

Week 3: Learn about common data storage mechanisms within GIS, including geodatabases and shapefiles. Learn how to choose between them for your projects and how to optimize them for speed and size. You'll also work with rasters for the first time, using digital elevation models and creating slope and distance analysis products.

Week 4: Explore datasets and assess them for quality and uncertainty.  You will also learn how to bring your maps and data to the Internet and create web maps quickly with ArcGIS Online.

Take GIS Data Formats, Design and Quality as a standalone course or as part of the Geographic Information Systems (GIS) Specialization. You should have equivalent experience to completing the first course in this specialization, Fundamentals of GIS, before taking this course. By completing the second class in the Specialization you will gain the skills needed to succeed in the full program.",INTERMEDIATE,English,https://www.coursera.org/learn/gis-data
w1OnRy1EEe-MmBK4EgZ1qQ,Systems Thinking Basics,"This course aims to help you understand the basic principles and concepts of systems thinking, identify and analyze the interrelationships in complex systems, apply systems thinking tools and methods to real-world problems and opportunities, and generate innovative ideas and solutions using systems thinking approaches.  

The course aims to cultivate an ability to think holistically, enabling learners to see beyond parts and appreciate the whole picture, which is crucial for addressing modern challenges across various domains, including business, environmental issues, and social systems.

This course is designed for Business Analysts, Project Managers, Strategy Consultants, Business Leaders, and Entrepreneurs. These professionals navigate complex environments and make strategic decisions that impact their organizations. By learning systems thinking skills, they will enhance their ability to see the bigger picture, recognize patterns, and understand business interconnections.

Participants should have a keen interest in problem-solving techniques and be open to questioning the status quo. This mindset is essential as systems thinking often involves challenging existing assumptions and considering new perspectives. No prior knowledge of systems thinking is required, but a willingness to engage with complex concepts and collaborate with others will be beneficial.

After completing this course, learners will be able to analyze complex systems by identifying and mapping their elements, interconnections, and feedback loops. They will apply systems thinking tools and methods to real-world problems and opportunities, demonstrating their ability to create holistic solutions. Additionally, learners will generate innovative ideas and solutions using systems thinking approaches, harnessing their critical and creative thinking skills to drive positive change in their organizations.",BEGINNER,English,https://www.coursera.org/learn/systems-thinking-basics
3791_tdbEeS2-SIAC4-TTw,Fundamentals of Management,"Are you about to enter the workforce? Are you an emerging professional? Are you new to your role in the organization? All prospective new employees benefit from understanding management principles, roles and responsibilities, regardless of position.  Now you can acquire an in-depth understanding of the basic concepts and theories of management while exploring the manager's operational role in all types of organizations. Gain insight into the manager's responsibility in planning, organizing, leading, staffing and controlling within the workplace. It’s never too soon to plan your professional path by learning how the best managers manage for success!

Upon completing this course, you will be able to:
1.       Describe the difference between managers and leaders
2.       Explore the focus of a manager’s job
3.       Cite the required skills for a new manager’s success
4.       Describe the five functions of management
5.       Explain the new model management operating philosophy
6.       Describe the hierarchy of planning
7.       Use the SMART goal setting technique
8.       Discuss the concept of evolution of leadership
9.       Explain how customer satisfaction is linked to controlling
10.     Discuss the power of building a network",Not Specified,English,https://www.coursera.org/learn/fundamentals-of-management
VuRXs3EiEeWrAxJQXw-8PQ,Fundamentals of Visualization with Tableau,"In this first course of this specialization, you will discover what data visualization is, and how we can use it to better see and understand data. Using Tableau Public, we’ll examine the fundamental concepts of data visualization and explore the Tableau interface, identifying and applying the various tools Tableau has to offer. By the end of the course you will be able to prepare and import data into Tableau and explain the relationship between data analytics and data visualization. This course is designed for the learner who has never used Tableau before, or who may need a refresher or want to explore Tableau in more depth. No prior technical or analytical background is required. The course will guide you through the steps necessary to create your first visualization from the beginning based on data context, setting the stage for you to advance to the next course in the Specialization.",BEGINNER,English,https://www.coursera.org/learn/data-visualization-tableau
ENhHCTboEeW8ZAoCexam_w,Data Analysis Tools,"In this course, you will develop and test hypotheses about your data. You will learn a variety of statistical tests, as well as strategies to know how to apply the appropriate one to your specific data and question. Using your choice of two powerful statistical software packages (SAS or Python), you will explore ANOVA, Chi-Square, and Pearson correlation analysis. This course will guide you through basic statistical principles to give you the tools to answer questions you have developed. Throughout the course, you will share your progress with others to gain valuable feedback and provide insight to other learners about their work.",Not Specified,English,https://www.coursera.org/learn/data-analysis-tools
ZoRf85v4Ee6OLRIoLG614w,Gen AI for Fraud Detection Analytics,"Welcome to the  'Generative AI in Fraud Detection Analytics' course, where you'll embark on a transformative journey to acquire practical expertise in generative AI for fraud prevention.

Throughout this course, you'll delve into the world of AI-driven fraud detection, mastering the fundamentals and exploring real-world applications. By the end of this course, you will be able to:

- Gain a comprehensive understanding of generative AI in fraud detection.
- Utilize generative AI techniques, especially the LSTM and GAN model, for practical email fraud 
 detection projects, strengthening the capacity to employ AI in real-world fraud prevention scenarios.
- Grasp the key concepts of generative AI's role in fraud detection, encompassing ethical considerations and best practices for data handling, establishing a strong foundation in AI-driven fraud analytics.

This course is tailored for learners from diverse backgrounds, including data scientists, fraud analysts, AI enthusiasts, and professionals aiming to enhance their skills in fraud analytics. Prior experience in AI and fraud detection is beneficial but not required.

Embark on this educational journey to master Generative AI for Fraud Detection Analytics and elevate your expertise in fraud prevention.",BEGINNER,English,https://www.coursera.org/learn/gen-ai-for-fraud-detection-analytics
8i2SyPvsEe2-pgqew4M3vw,Linear Regression,"This course is best suited for individuals who have a technical background in mathematics/statistics/computer science/engineering pursuing a career change to jobs or industries that are data-driven such as finance, retain, tech, healthcare, government and many more. The opportunity is endless.  

This course is part of the Performance Based Admission courses for the Data Science program.  

This course will focus on getting you acquainted with the basic ideas behind regression, it provides you with an overview of the basic techniques in regression such as simple and multiple linear regression, and the use of categorical variables.  

Software Requirements: R

Upon successful completion of this course, you will be able to: 

- Describe the assumptions of the linear regression models. 
- Compute the least squares estimators using R.
- Describe the properties of the least squares estimators.
- Use R to fit a linear regression model to a given data set.
- Interpret and draw conclusions on the linear regression model.
- Use R to perform statistical inference based on the regression models.",INTERMEDIATE,English,https://www.coursera.org/learn/illinois-tech-linear-regression
JHBw7jvqEfCxwxJQM9bC_Q,The CISO Masterclass,"This course features Coursera Coach!

A smarter way to learn with interactive, real-time conversations that help you test your knowledge, challenge assumptions, and deepen your understanding as you progress through the course.

The CISO Masterclass is designed for aspiring CISOs, security leaders, and those interested in understanding the journey to the CISO role. By the end of the course, you will have a clear understanding of the essential personality traits of a CISO, be able to develop a comprehensive 90-day plan that includes people, processes, technology, and budgeting, and know how to create a robust cybersecurity strategy. You will also gain the skills to evaluate security metrics and tackle challenges such as budget constraints and team management, preparing you for real-world CISO responsibilities.

As you progress, you’ll embark on a step-by-step journey that starts with career reflections and progresses through the essential 90-day plan for a CISO. This plan focuses on people, processes, technology, and budgeting, ensuring you are well-prepared for real-world CISO challenges. Additionally, the course covers the crucial aspects of cybersecurity strategy and metrics, helping you to assess and improve the effectiveness of your security posture.

This course is ideal for those seeking to understand the CISO position, from role responsibilities to leadership strategies. A foundational understanding of information security principles and a keen interest in advancing into cybersecurity leadership are recommended.",INTERMEDIATE,English,https://www.coursera.org/learn/packt-the-ciso-masterclass-ylnac
XvJBLJVHEea0-w59UvC4Ag,Financial Accounting Fundamentals,"This course, developed at the Darden School of Business at the University of Virginia and taught by top-ranked faculty, will teach you the tools you'll need to understand the fundamentals of financial accounting. Concise videos, the financial records of a small business, and ""your turn"" activities guide you through the three most commonly used financial statements: the Balance Sheet, the Income Statement, and the Statement of Cash Flows. Beyond recording transactions, you'll learn how to prepare these financial statements, and read and analyze them to draw basic conclusions about a company's financial health.

By the end of this course, you will be able to:
- Use journal entries to record transactions
- Prepare and use t-accounts to summarize transactions recorded during an accounting period
- Describe the three most commonly used financial statements and how they fit together
- Prepare these financial statements based on transactions recorded during an accounting period
- Draw basic conclusions about a company's financial health",BEGINNER,English,https://www.coursera.org/learn/uva-darden-financial-accounting
5aTJVUhVEeWJHwqqqPAooQ,Subsistence Marketplaces,"The foundation for this course lies with unique synergies between pioneering research, teaching, and social initiatives through the Subsistence Marketplaces Initiative. Unique to this approach is a bottom-up understanding of the intersection of poverty and the marketplace.

The goals of this course are to help you develop an understanding of marketplace activity in the radically different context of subsistence where much of humanity resides and survives, and for you to design solutions that can be implemented by individuals, businesses, and social enterprises through economically, ecologically, and socially sustainable products for subsistence marketplaces.",BEGINNER,English,https://www.coursera.org/learn/subsistence-marketplaces
41yk6loBEe244QqZ1Zw-dQ,Creating a Technology Startup Company,"The course starts by exploring entrepreneurial ecosystems and systems thinking. The Technology Adoption Life Cycle is introduced to help explain market dynamics and support developing business strategy. Market research concepts and tools are presented that learners will apply to their course projects. Founder, key manager, and board member considerations are examined, and the qualities of effective leadership are reviewed. The operational structures and processes of a tech startup are identified, and the Balanced Scorecard is presented as a tool for tracking critical performance metrics. Learners will create a first draft of Product, Market, and Management & Operations Plans for their new product or service ideas.

Creating a Startup Company can be taken for academic credit as part of CU Boulder’s Master of Engineering in Engineering Management (ME-EM) degree offered on the Coursera platform. The ME-EM is designed to help engineers, scientists, and technical professionals move into leadership and management roles in the engineering and technical sectors. With performance-based admissions and no application process, the ME-EM is ideal for individuals with a broad range of undergraduate education and/or professional experience. Learn more about the ME-EM program at https://www.coursera.org/degrees/me-engineering-management-boulder.",BEGINNER,English,https://www.coursera.org/learn/creating-a-technology-startup-company
BNYWC1u2EfCt0wr_8L_7mQ,Unix System Overview and Command,"This comprehensive course equips learners with the essential and advanced skills needed to navigate, manage, and optimize Unix-based systems through powerful command-line utilities. Designed for beginners and intermediate users alike, the course blends foundational concepts with real-world command usage.

Through three in-depth modules, learners will first identify core Unix structures and navigate directories using shell commands. They will then manipulate files, filter text streams, and employ communication and data redirection techniques. Finally, learners will integrate remote access tools, automate responses, and apply archiving utilities to streamline system-level operations.

By the end of the course, learners will be able to confidently analyze, execute, and optimize Unix system operations for administration, scripting, and automation purposes.",INTERMEDIATE,English,https://www.coursera.org/learn/unix-system-overview-and-command
A4W_GyDjEeW5Rwo0txKkgQ,Introduction to Programming with MATLAB,"This course teaches computer programming to those with little to no previous experience. It uses the programming system and language called MATLAB to do so because it is easy to learn, versatile and very useful for engineers and other professionals. MATLAB is a special-purpose language that is an excellent choice for writing moderate-size programs that solve problems involving the manipulation of numbers. The design of the language makes it possible to write a powerful program in a few lines. The problems may be relatively complex, while the MATLAB programs that solve them are relatively simple: relative, that is, to the equivalent program written in a general-purpose language, such as C++ or Java. As a result, MATLAB is being used in a wide variety of domains from the natural sciences, through all disciplines of engineering, to finance, and beyond, and it is heavily used in industry. Hence, a solid background in MATLAB is an indispensable skill in today’s job market.

Nevertheless, this course is not a MATLAB tutorial. It is an introductory programming course that uses MATLAB to illustrate general concepts in computer science and programming. Students who successfully complete this course will become familiar with general concepts in computer science, gain an understanding of the general concepts of programming, and obtain a solid foundation in the use of MATLAB.

Students taking the course will get a MATLAB Online license free of charge for the duration of the course. The students are encouraged to consult the eBook that this course is based on. More information about these resources can be found on the Resources menu on the right.",BEGINNER,English,https://www.coursera.org/learn/matlab
2S5f6J2JEe-XQxLwNDvmSw,Site Investigation,"Welcome to the comprehensive Site Investigation course, unfolding across four enlightening modules crafted to provide learners with a profound understanding of the complex world beneath our feet. In Module 1, participants will delve into diverse site investigation types, methods, and codal provisions, gaining practical insights to adeptly select drilling and sampling approaches tailored to specific soil conditions. Module 2 will take learners on an exploration of field tests, including SPT, SCPT, DCPT, and Plate Load Tests, fostering proficiency in conducting these tests and providing a nuanced understanding of alternative methods such as Vane Shear Test and Pressuremeter Tests. In Module 3, learners will unravel the essentials of site investigation reports, mastering the analysis of crucial data while delving into the intricacies of liquefaction susceptibility and mitigation methods. Finally, Module 4 will immerse learners in a Virtual Laboratory for soil testing, where they will acquire hands-on skills in conducting tests like liquid limit, plastic limit, compaction, shear strength, consolidation, and permeability—essential tools for their journey into the realm of site investigation and engineering applications. 
To strengthen acquired knowledge and ensure a continuous learning flow, learners are encouraged to regularly participate in the course on a weekly basis. Consistent review of topics not only fosters clarity but also deepens understanding. Quizzes and assignments are thoughtfully designed to evaluate learners' comprehension, and in instances of difficulty in recall, revisiting content for better understanding is always an option. Supplementary reading materials are provided for additional information and in-depth analysis. Learners are urged to explore these materials, as they delve into practical aspects and real industry cases. Active engagement in the discussion forum is strongly advocated. Collaborating with peers facilitates the exchange of ideas and perspectives, fostering a cooperative learning environment. Interacting with peers proves valuable for validating and reinforcing learning.
The course, meticulously crafted and presented by professionals with extensive industry expertise, provides an excellent opportunity to glean insights from seasoned masters. Get ready to uncover the secrets beneath the surface and build a solid foundation of knowledge in Site Investigation!",INTERMEDIATE,English,https://www.coursera.org/learn/site-investigation
HHIwfNd-Ee24zA5Eu0YNIw,Optimizing Applications Using Cloud Profiler,"This is a self-paced lab that takes place in the Google Cloud console. In this lab, you will learn how to use the Cloud Operations Tracing and Profiler tools to diagnose and correct application latencies.",BEGINNER,English,https://www.coursera.org/learn/googlecloud-optimizing-applications-using-cloud-profiler-1sh2v
I4IHiKkpEeyxDg4ukgkVlw,Using OpenTSDB to Monitor Time-Series Data on Cloud Platform,"This is a self-paced lab that takes place in the Google Cloud console. In this lab you will learn how to collect, record, and monitor time-series data on Google Cloud Platform (GCP) using OpenTSDB running on Google Kubernetes Engine and Google Cloud Bigtable.",INTERMEDIATE,English,https://www.coursera.org/learn/googlecloud-using-opentsdb-to-monitor-time-series-data-on-cloud-platform-spfpj
ov1xf4gpEe-DEBK9SfSQ3Q,Agile Leadership Principles and Practices,"Develop Agile Leadership skills. Master change management, evolve leadership theories, and Agile principles to drive collaboration, empower teams, and lead effectively in dynamic environments.

This Agile Leadership Principles course takes you from foundational leadership concepts to advanced agile practices. You’ll explore how modern leadership values collaboration, continuous improvement, and empowering teams. Learn to facilitate self-organizing teams, delegate effectively, and align your team around shared goals.

The course covers evolving leadership theories, the difference between leadership and management, and how agile integrates the best of modern leadership practices. Understand key agile roles like Scrum Master and Product Owner to lead projects smoothly and foster a motivated, autonomous team environment.

Designed for new and experienced leaders, this course emphasizes developing an agile mindset—embracing transparency, adaptability, and continuous learning. By the end, you’ll be ready to create high-performing teams, improve decision-making, and navigate change with agility.

Join now to transform your leadership approach and make a lasting impact in your organization.",INTERMEDIATE,English,https://www.coursera.org/learn/agile-leadership-principles-and-practices
lVrEVwQlEfCPRRJPAkb9OQ,Coding Algorithms with AI,"In this second course in the ‘Coding with AI for MBAs’ specialization, we’ll continue with a contemporary, AI-forward, product-first approach to coding. As an MBA or generalist, this course will help you go from design to code for ‘Controllers’, or ‘algorithms’. Understanding the process of building and maintaining algorithms with AI will both help you build great products yourself as well as make yourself a better collaborator to your engineering-focused colleagues. We’ll be coding in Javascript (JS), but mostly we’ll be focused on the underlying design and engineering principles for building user interfaces. This course was developed at the Darden School of Business at the University of Virginia and is taught by top-ranked faculty.",BEGINNER,English,https://www.coursera.org/learn/uva-darden-coding-algorithms-with-ai
_igbToEHEe-uIwr_5K4XQQ,Basic English Skills : Visit California,"This is primarily aimed at anyone who has attempted learning English and want a second chance at it, and/or additional practice. This course will focus on the theme of travel to develop and build basic English skills and may already be at A1/A2 level. At the end of this course, you will be able to recognize and accurately use an expanded range of everyday vocabulary in context, construct grammatically correct sentences and short paragraphs using fundamental grammar rules, understand and articulate simple ideas effectively, and demonstrate increased confidence in listening to and speaking in English through practical, everyday interactions.",BEGINNER,English,https://www.coursera.org/learn/basic-english-visit-california
_2rQV8VtEeyomwo-MdMgTQ,Get started with Microsoft Planner,"In this project, learners will become familiar with Microsoft Planner. They will learn how to create tasks and make adjustments to those tasks. Learners will also get to practice multiple scenarios involving creating plans. By the end of the course, learners will understand how to create and assign tasks, as well as integrate Microsoft Planner with other applications.",BEGINNER,English,https://www.coursera.org/learn/get-started-microsoft-planner
